{
  "schema": "inside-valdivia.operation-invocation/1",
  "id": "example-keyframed-generation-0001",
  "operation": "generate.keyframed",
  "operation_version": 1,
  "operation_contract_hash": "293c342e54d66ac4b8f5147636e9aa0617635abba5d2d4acc2919999104208b1",
  "inputs": {
    "first_frame": "input://frames/example-start.png",
    "last_frame": "input://frames/example-end.png"
  },
  "parameters": {
    "variant": "first-last",
    "target_frames": 124,
    "prompt": "replace with the exact production prompt",
    "seed": 0
  },
  "status": "planned",
  "outputs": {},
  "run_receipts": [],
  "notes": "Template only; duplicate with exact project media and bindings."
}
