{
  "schema": "inside-valdivia.operation-invocation/1",
  "id": "2026-09-01-24-gen45-temporal-expand-2x-s08",
  "operation": "generate.with_guides",
  "operation_version": 3,
  "operation_contract_hash": "49aa03c63837e7cbc3dd09992e6575196dced0061847986f8643b347cbe98dfc",
  "inputs": {
    "source_video": {
      "uri": "comfy-input://inside-valdivia/temporal-expansion/Gen-4_5.gen-4_5 (5).mp4",
      "sha256": "d7300236e2a395c3c91eb59e05fcc2a0895956b53cb170316ae7480564da16a3"
    }
  },
  "parameters": {
    "variant": "sparse-anchor-temporal-expansion",
    "factor": 2,
    "source_start_frame": 0,
    "source_frames": 60,
    "source_stride_frames": 8,
    "source_guide_offsets": [0, 8, 16, 24, 32, 40, 48, 56, 59],
    "target_guide_indices": [0, 16, 32, 48, 64, 80, 96, 112, 118],
    "guide_count": 9,
    "target_frames": 124,
    "delivery_frames": 119,
    "delivery_fps": 24,
    "width": 672,
    "height": 672,
    "steps": 20,
    "sampler": "res_multistep",
    "scheduler": "simple",
    "seed": 310944,
    "runtime_seconds": 118.598
  },
  "status": "executes",
  "outputs": {
    "video": "comfy-output://video/2026-08-31/gen45_slowmo2x_stride8_w01_f000_s08_00001_.mp4"
  },
  "run_receipts": [
    "runtime/receipts/2026-09-01/gen45-slowmo2x-s08-w01/2a049c9d-f944-45e7-ab8e-c63c138ec427.json"
  ],
  "notes": "Sparse official AddGuide 2x expansion of the first 60 decoded frames. Exact 119-frame delivery geometry is verified and sampled technical inspection remains coherent; operator review is pending."
}
