{
  "schema": "inside-valdivia.operation-invocation/1",
  "id": "2026-08-31-02-fl2va-last-frame",
  "operation": "generate.keyframed",
  "operation_version": 2,
  "operation_contract_hash": "3d9f3d24a99ac78161ea7b7bd2c4e976795b94c37bc890613873bf70d9ce05df",
  "inputs": {
    "last_frame": {
      "uri": "comfy-input://inside-valdivia-frame-b.png",
      "sha256": "dc34fc48c6ea7b5df5924dd2a856b573ab1f2f2058d9bbb4e943daf342eab767"
    }
  },
  "parameters": {
    "width": 1344,
    "height": 768,
    "target_frames": 124,
    "fps": 24,
    "steps": 20,
    "sampler": "res_multistep",
    "scheduler": "simple",
    "variant": "last-frame",
    "seed": 260831,
    "prompt": "A single uninterrupted cinematic camera move through one continuous real temperate rainforest wetland. The camera glides slowly forward at eye level with physically coherent parallax. Water flows gently and leaves move subtly in the wind. Preserve stable trees, terrain, scale, lighting and spatial geometry. Photorealistic natural motion, no cuts, no dissolves, no morphing, no sudden acceleration, no people, no text, silent imagery."
  },
  "status": "executes",
  "outputs": {
    "video": "comfy-output://video/2026-08-31/02_fl2va_last_b_00001_.mp4",
    "native_state": "comfy-output://cauce/latents/2026-08-31/02_fl2va_last_b_00001.safetensors"
  },
  "run_receipts": [
    "runtime/receipts/2026-08-31/02-fl2va-last-frame.json"
  ],
  "notes": "Live H3 characterization batch. See docs/LIVE_BATCH_2026-08-31.md for measured visual evidence and limitations."
}
